"reviewer","profile_link","review_date","helpful_count","overall_rating","review_body"
"Vanished","/profile/Omodrama","Sep 20, 2017","1","10","Overall 10    Story 10 Acting/Cast 9.5 Music 9.5 Rewatch Value 10      “Goblin: The Lonely and Great God” which aired from December 02, 2016 to January 21, 2017, stars a very wide range of actors and actresses in its cast lineup. From the Original Soundtrack to the cast, to the way this drama was filmed, I could tell that this was going to be a hit from the moment I sat down to watch it. From the very first 5 minutes of this drama, I was already hooked and ready to ride it out. I remember I watched the first 9 episodes in 1 night. An addicting and emotional story of the Goblin, his bride, his friend, his enemy, his sister, and his family is an amazing drama that I really enjoyed with all my heart.  The story, the tragic story at that, of Goblin, is really compelling. Kim Eun Sook is really a master storyteller. She writes characters and situations that make your heart skip a beat or even break. I found myself extremely emotionally invested in the love and friendship of the characters in this drama. However, I will be honest, I didn’t know if I actually liked our main female lead until about episode 11, I was on the fence about her, but in the end, I did really enjoy her. There were no characters that I thought were poorly written or not worth the emotional investment, I found each of them to be extremely well thought out and very realistic. Well, as realistic as you can get for a fantasy drama that is.  This drama had so much going for it. It was literally the most aesthetically pleasing drama I have ever watched. The cinematography, the lighting, the color correction, just everything was so beautiful. The way they made this drama look fit the fantasy aesthetic of the drama as well, everything seemed so dream and wonderland like. The original soundtrack for this drama did have me on the fence for a while as well. I was wondering if I really enjoyed the music for the drama or not, but in the end, I found myself humming and singing along to all the songs. They all fit the drama well and put a certain tone and mood to each scene which is what I always say I want. I love OSTs that can give me songs to sing later in life and that make the scene more impactful, and it gave me both.  The acting in this drama was fantastic for the most part, there was one part where I was iffy about it, but it was a really minor character crying so I will let that slide. Gong Yoo was fantastic, it is great to see him in another drama, not just movies, since BIG which was a total flop for me. I have always thought we were a great actor and that BIG was a bad choice on his part. Perhaps that is why he has strayed away from dramas for a few years, but I am glad to see him back in action. His sad smile and his eyes always filled with pain were really convincing and I hope I see him in more and more drama now that he is back in the drama game. It was my first time encountering Kim Go Eun, I know that her first drama was Cheese in the Trap which I know a lot of people loved, but I also heard the ending to the drama was pretty lame, so I have yet to go and see it. She is a young woman, my age (I’m trying to say I’m young at 26 lol). I did have questions about my liking for her character at times, but I thought she did a fantastic job either way. Lee Dong Wook never lets me down, he always brings his A game, and I was happy to see him again after my long drama hiatus. His character was possibly my favorite, I felt his pain and I loved the way his character developed throughout the entire drama itself. He was just great and there really isn’t more to say about that. Yoo In Na surprised me, I really liked her. The last drama I watched her in was You Who Came From The Stars which I actually don’t remember her in, so I don’t know what that says about her role. All I can remember is Queen In Hyun’s Man which I was really not that impressed with, so I’m kind of happy to be discovering her like she is fresh and new in my mind. Overall, the acting was just fantastic and everyone portrayed their characters well.  This drama was an emotional roller coaster. From laughs to tears within the same episode, this drama really had a way with playing with your emotions. You can get extremely invested in the characters of this drama and you hope and pray for a happy ending for them all, and I found myself truly infatuated with it. From the scenery to the story itself, and the music that will forever be ingrained in my mind, the drama was just plain old fantastic. This time, the hype train didn’t let me down, and I am proud of it for that. There is drama out there that are truly worth the hype. I would assume that everyone has already seen this drama. But, if you haven’t I hope that you will settle down for 16 episodes of pure fantasy, magic, and beauty that this drama has to offer. It is worth the watch and worth a re-watch while you are at it.  Read More  Was this review helpful to you? Yes No Cancel (Full Review Not Available)"
"Mara","/profile/Mayap","Jan 21, 2017","1","10","No Review Available"
"Anca","/profile/yoongisgf","Jun 15, 2017","1","10","Overall 10    Story 10 Acting/Cast 10 Music 8.0 Rewatch Value 9.0    This review may contain spoilers   If you want to watch this drama, be ready for an emotional rollercoaster! This is the first drama that makes me cry a lot, but also laugh a lot. It combines both dramatic and funny elements wonderfully.    Spoilers ahead:  The cast and acting were A+!! I was really happy to see Sungjae in a drama and I'm so happy he was such a great actor! I usually am a little skeptical when I see idol actors because I've seen some who weren't that good, but he was really great and I'm happy for him! Gong Yoo and Lee Dong Wook were exceptional! While I wasn't that impressed with Lee Dong Wook's acting in Hotel King, I found it to be exceptional in this drama and I feel like he improved a lot! His friendship with the goblin was hilarious and wonderful, I loved it! This is the first drama with Kim Go Eun I watch and she was great, I think she did a good job and I will surely watch other dramas in which she played! Before Goblin, I knew Gong Yoo from Coffee Prince and I can't say I had any opinion on him, but after this, I'm in love! His ability of conveying emotion is fantastic!  I know Yoo In Na from 'My Love From Another Star' and I couldn't really form an opinion on her, especially since I can't say I was impressed with her acting, but I really liked her in this drama! The subject was a new an interesting one for me, but I couldn't really understand why he was cursed even after she pulled the sword out and summoned him back. I would have expected him to age again, but idk. And if you think about the fact that he's cursed to lose her in all of her 4 lives and then never meet her again, it makes it even sadder! Overall, it was a wonderful drama and I wholeheartedly recommend it!  Read More  Was this review helpful to you? Yes No Cancel (Full Review Not Available)"
"nature456","/profile/shinyanushka94","Jan 24, 2017","1","10","No Review Available"
"TaraLynch","/profile/agrimony","Feb 12, 2017","1","10","Overall 10    Story 9.5 Acting/Cast 10 Music 10 Rewatch Value 10      I also recently finished watching Goblin: The Lonely and Great God. This show is also by tvN. It was beautiful, poignant, lyrical (to borrow Christina Bertani's descriptor), and all around wonderful. It stars the always amazing Gong Yoo (who I first loved in my first K-drama, Coffee Prince) as the Goblin cursed with immortality and Kim Go Eun (who did her television debut in 2016 in Cheese in the Trap) as the Goblin's Bride, who can see ghosts and is the only one who can break his curse. It also stars Lee Dong Wook (who, I will be perfectly honest, I feel in love with while watching him on the variety show Roommates and have loved in everything I've seen him in) who plays a Grim Reaper and his love interest is played by the very beautiful Yoo In Na (who I've seen in several shows and I'm very glad she finally gets to play a character who is not an utter bitch). There is no one on this planet who is as good at the wounded, kicked puppy look as Lee Dong Wook. You just want to hug him and carry him around in your pocket. I give this drama 5 out of 5 on DramaFever (where I watched it) and 10 out of 10 on MyDramaLIst. I'd give it 1000 out of 1000, even. The bromance between the Goblin and the Grim Reaper is amazing and would make this drama a joy to watch even if everything else in it sucked. Luckily, nothing in it sucks. Except maybe the age difference between the Goblin and his bride. But given how chaste k-drama romance is, I am easily able to give that a pass. :)  Read More  Was this review helpful to you? Yes No Cancel (Full Review Not Available)"
"Silvertide","/profile/Silvertide","Feb 13, 2017","1","9.0","Overall 9.0    Story 9.0 Acting/Cast 10 Music 9.0 Rewatch Value 5.0      Goblin is a good drama, but even though I gave it a 9, it is not the best in other ways. I'll talk about what was good about the drama first, then I'll talk about what I disliked about the drama.  Characters  The characters were all great, especially the two male leads. Their interactions with each other were especially entertaining. I can't say for sure that I really disliked any of the characters, though I think I liked the second leads better than the male leads. They were more entertaining and they made a little more sense than the main leads, which I will get back to later.  Actors  I loved every one of the actors. Usually there's an actor I hate, but not in this drama. They were all enjoyable to watch and they all did a splendid job.  Plot  The story was interesting, especially with the grim reaper stuff. In the end I kind of wish that the way life and death work in the show would work similarly in real life too. The plot always kept me interested throughout the show and there were a lot of cliff hangers. Stupid plot devices were used sparingly and they partially made sense.  Visuals  The cinematography was fantastic. Even if you don't like everything else about this show, you will just like looking at it. It is beautiful and a sight for sore eyes.  Music  I love the majority of the music in this show and I've listened to many of the songs multiple times. The soundtrack really stood out and I don't think I really disliked any of the songs.  What I Disliked  I felt absolutely no chemistry between the male leads, personally. I thought they made great friends, but I always grimaced at any romantic moments. I just couldn't see them together romantically. I see them as inseparable friends, but no more than that.  Also, the main male lead kind of irritated me. He's supposed to be like 800+ years old but he acts like a child. Also, you cannot tell me that he never fell in love with anyone until he met the main female lead. I think it is an excuse to blame his childlike behavior on his personality. In You Who Came from the Stars, the main male lead had lead a similarly long life like the main lead of Goblin, but he was not childish in any name of the word. I felt that his personality was far more realistic for someone that had lived for a long time. As a character the main lead of Goblin is great, but when you realize how long he's lived he just doesn't make sense.  Overall  Of course I recommend that you watch Goblin. Overall it was a really good show and there are plenty of reasons to watch it despite my negative comments at the end. Give it a try and you'll probably like it.  Read More  Was this review helpful to you? Yes No Cancel (Full Review Not Available)"
"Cho Na","/profile/ChouNa","Oct  1, 2019","1","10","Overall 10    Story 10 Acting/Cast 10 Music 10 Rewatch Value 10    This review may contain spoilers   I had put off watching Goblin for a long time as I knew it's epic so I needed a devoted time to watch it till the end. Goblins becomes the highest standard of my reviews on dramas I completed (mostly for Kdramas). What I learned from this drama: forgiveness (past events of Goblin/Grim Reaper/Sunny) and that there is timing for everything you encounter in life (Goblin waits for 900+ years for a 19 year old bride to show up in her first life)Tons of previous reviews posted already, so I will just point out what I like about this drama:Story: No boring scene, no skipping for me who likes skipping scenes. Side stories of dead people and ghosts are also meaningful and touching.Directing: Just perfect, won't say much, check out other Director Lee Eung Bok's cinematic workEditing: Details are woven perfectly, and all related. Pieces of flashback are not boring.Screenwriting: witty, deep, poetic. Follow Writer Kim Eun Sook for other high quality dramas.CGI: Battle, fight, and snow scenes of Goblin are epicLocation: Quebec Canada, can't have other perfect location than fall season with French touchMake up: Can transform one actor/actress to different roles. For examplem Kim Byung Chul as Emperor advisor, modern secretary, ghost, and cameo CEO.Costume: Classy and stylish. For example: 19 year old Eun Tak does not look poor and childish. Personality symbols thru costumes, for example Shamsin Lady's red dress, Sunny's bright colored clothing, and Eun Tak's red scarfCast: Perfect selection for every main roles and supporting casts are not bad either. Gong Yoo and Lee Dong Wook supernatural roles don't need to talk much but their facial expression shows deep communications. Kim Go Eun's natural beauty fits for 19 year old girl, Yoo In Na's cheerfulness matches Sunny lively personality.Acting: Lots of scenes with no dialogues just facial expression and physical movements speak louder than many dialoguesMusic: songs are created and picked perfectly support the popularity of the drama and songs themselvesRewatch: perfect, but I will wait for a while until I can spend a large portion of my time to watch it  Read More  Was this review helpful to you? Yes No Cancel (Full Review Not Available)"
"Christelou","/profile/Christelou","Jan 31, 2017","1","10","No Review Available"
"yuki","/profile/lucy-ann","Mar  3, 2017","0","9.0","No Review Available"
"AROHACindy","/profile/DramaCuukies","Apr 19, 2017","0","10","No Review Available"
"DemonLordie","/profile/DemonLordie","Apr 19, 2017","0","10","No Review Available"
"Mariposatraicionera","/profile/7821271","Jun  4, 2020","2","10","No Review Available"
"nuda","/profile/nunu87","Mar  6, 2017","1","9.5","No Review Available"
"Yuna","/profile/Busan_Cake","Feb  4, 2017","1","9.0","Overall 9.0    Story 9.0 Acting/Cast 10 Music 8.5 Rewatch Value 9.0      I thought a very long time about if I should watch this drama or not. And now I have to say I shouldn't have watch it. Not because it was bad but because I have a problem know. The drama results in a special interest in some of the Actors (especially one of them).   Story: After I have watched most of Kim Eunsooks dramas I was excited when Goblin was first announced. But then there was the casting. Although I liked the story from the beginning I didn't know If I should watch the drama. But then I read many positive about it and so I gave it a chance. The Story is about a goblin, but I was more interested in the story about the Grim Reaper. I love Grim Reapers. I don't know why but every time I think about fantasy stories, I think about the grim Reaper o.o.  Acting/Cast: When I heart of the Cast I wasn't very excited to watch Goblin. I will begin with Kim Goeun. I didn't know her very well, but I used to watch Cheese in the trap and dropped it after one episode, because of Kim Goeun. I don't know if it was her character or her acting, but I couldn't stand it. So her casting wasn't a reason for me to watch the drama. But in the End I have to admit that she is a very good actress. Her Character is one of those who grow from episode to episode. At first I didn't like her Euntak, but after a few episode I liked her. Kim Goeun plays the role very emotional and the role was sure very hard to play. But she made the best of it. The last drama of Gong Yoo I have watched was Big...And I dropped it after a few episodes. It wasn't because of him but because of the story and the female lead. But he wasn't so good, that I've watched it for him. The role of an over 900 year old goblin who is tired to live but has no other choice suits him very well. The big age gap between Kim Goeun and him doesn't annoy. He doesn't look like his age and his character who sometimes can be cute and childish is funny and gives fresh wind. Gong Yoo is a very great Actor and I hope his future roles will suit him as well as this one. Next up is Yoo Inna. I watched Queen Inhyun's Man and a little bit of One more Happy Ending. The first was very good, the latter was bad, so I dropped it. In Goblin she plays a Chicken restaurant owner. She remembered me a little bit of her role in Queen Inhyun's Man. Maybe I liked her role because of this so much. Her Scenes with Lee Dongwook were so intensive and the chemistry was the best. Her Acting is amazing in this drama, the most in the second half of the Drama. Now I come to my favourite character and Actor in the whole Drama. Lee Dongwook...I watched him first in one of my first K-Dramas (My Girl) where I liked him (but there was also Lee Junki v.v). Then there was Scent of a woman, where he broke my heart into pieces because his acting was perfect. After that drama I lost him out of my eyes. I began this drama because I wanted to see him again, but I thought he would be the second Lead. Kim Eunsook is wonderful. After Descendants of the Sun, a second time she spares us  with a second lead syndrome. Thank you so much! Lee Dongwook acts as a Grim Reaper who can't remember his past life. His Bromance with the Goblin is funny and excellent. The Chemistry between the two Actors is very very good. Lee Dongwooks acting skills in Goblin surpasses his skills in Scent of a Woman. I didn't know it would be poosible but the role of a Grim Reaper and his chemstry with Gong Yoo and of course Yoo Inna is amazing. I love this Oppa because he wakes up feelings. If he cries I want to cry, too. If he laughs, I want to laugh, too. But the most of the Time I wanted to give him a big hug.  Music: The Soundtrack is very good. I love the song Wish by Urban Zakapa the most. But Soyus OST is very good, too.  Rewatch value: Very high, but for now I want to watch Lee Dong wooks other dramas, I didn't watched.  Read More  Was this review helpful to you? Yes No Cancel (Full Review Not Available)"
"Emma","/profile/EmmaReneee","Jun 26, 2017","1","10","Overall 10    Story 10 Acting/Cast 10 Music 10 Rewatch Value 10      This drama is so amazing! I can't even express with my words how I feel about this drama. It has everything you could want, drama, romance, sorrow, happiness, plot twists, and so much more. The music was beautiful, it always fight perfectly with the scenes it was chosen for. I probably went though at leased 3 boxes of tissues from my happy and sad tears. If your not into historical dramas the only parts that are historical are at the beginning to set up the background of Kim Shin and etc. The cast all were perfect for their chosen parts. I found the acting superb. Personally my favorite character was the Grim Reaper. As you progress in the episodes you bond deeply with each character as their stories are laid out in front of you. Different obstacles arise for the characters and you get to see them get though it and it's dramatic all the way. The ending was well rounded and perfectly executed. It didn't leave me unsatisfied or confused at all. I only have good things to say about this drama and it will forever be my number one favorite. Highly recommend everyone to watch this because it, you won't regret it.  Thanks for reading my review this far, if you have! :)  Read More  Was this review helpful to you? Yes No Cancel (Full Review Not Available)"
"2013started","/profile/2013started","Jan 30, 2017","1","9.0","Overall 9.0    Story 8.0 Acting/Cast 9.0 Music 8.0 Rewatch Value 8.0      Cinematography - 10 Acting - 9 Plot - 8 The first episode was impressive -- the director was able to cover a large time frame and maintain the continuity of the story.  That episode set the stage for the drama.  Now, mind you, they are actors and adults, the couples' age gap should not deter your judgement of watching a spectacular drama. The actors/actresses  were all amazing, I mean you can just really feel the sadness, the distress, the sorrow and then the sweetness (that does not go overboard to childishness), the happiness, the camaraderie...  Add to this, this was a great comeback of Gong Yoo to drama land and when he had his sad moments in teh drama you just want to tell him to not be sad because his face just makes you ""aawww, don't be sad..."".  Read More  Was this review helpful to you? Yes No Cancel (Full Review Not Available)"
"HealingVibes","/profile/SCOppa","May 25, 2023","3","5.0","Overall 5.0    Story 5.5 Acting/Cast 7.0 Music 5.5 Rewatch Value 3.5    Irritating female lead!   I'm here for Lee Dong Wook, and even then, I couldn't bear to watch through the series despite wanting to watch him! The storyline itself is quite nice, actually. I love the fantasy element of it all, except....The immature, childish, stubborn, reckless and irritating FL.  I'm afraid this is a very unhealthy and toxic portrayal on how a woman should behave! The fame of the show seems to agree that the FL needs to be ""saved"" all the time, that it's okay to be demanding and act cute towards a guy, because people think that's cute? But, it just further promotes behavior of woman having to act cute, pretend to be weak, and to be spoilt, just because they are female. My intolerance towards FL made me dropped the show. This means a lot, because I usually am very generous with rating. I easily give a rating of 8-10, in general. So, for me to give this rating means that's how underrated and disappointing this show isHaving said that, I really hope people still continue watching LDW, because he is an amazing actor! It's not his fault that the show turns out this way :P   Read More  Was this review helpful to you? Yes No Cancel (Full Review Not Available)"
"corn salad","/profile/qaz_jr","Oct 20, 2022","1","5.0","Overall 5.0    Story 7.5 Acting/Cast 10 Music 8.5 Rewatch Value 1.0    Amazing start but OMG it gets so slow  ok when i started it i was in shock how good it was. first 6 eps were AMAZING but the way the writers killed the vibe pissed me off so hard...the story is amazing dont get me wrong but the writers needa get fired for ruining a show with such high possibilities.  every 2 mins there the 15 second slowmo music scene which enrages me so much...like its ok a couple of times but BRO stop it....it made me so angry that i no longer want to know if that damn blade comes out or not...i feel so bad for the writers cuz the base plot is so good but it just gets sooooooooo slowwwwwww. the actors are the best and they dont deserve such a bad director...i never drop shows and i think i will eventually finish it but that won't be happening in the next 2 yrs  Read More  Was this review helpful to you? Yes No Cancel (Full Review Not Available)"
"Olivia","/profile/livh3","Jan 23, 2017","1","10","No Review Available"
"eM_","/profile/10870207","May 20, 2023","0","10","No Review Available"
"laigle-noir","/profile/laigle-noir","Dec  6, 2023","0","10","No Review Available"
"wiambns","/profile/wiambns","Aug 11, 2024","0","9.0","No Review Available"
"Neelshika_nissy","/profile/Neelshika_nissy","Aug 15, 2023","0","10","Overall 10    Story 10 Acting/Cast 10 Music 10 Rewatch Value 6.0    goblin   Omg !!!!! I have so much to say but ill try my best to shorten it fr u guys , i'll try my best to avoid any spoiler ?. If you've seen the 5 stars and hv already gone to watch the show you did a great job , but if you're still here reading this review ill give you guys some 'more than satisfactorIf you are hesitating to watch this at all, please....just throw out your reservations and watch this. Goblin has just made my favorites list. Even my husband got sucked in and loves this show. The cinematography was gorgeous, the music was amazing, the actors were perfect (Hello, Gong Yoo!),  Read More  Was this review helpful to you? Yes No Cancel (Full Review Not Available)"
"jenn","/profile/monpetittk","Jan 11, 2023","0","10","No Review Available"
"ste_jorge","/profile/ste_jorge","May 30, 2024","0","8.0","No Review Available"
